{
  "$comment": "Selected engine-curve points and POH cruise/glide values as cited facts; not a copy of any chart or table and not a flight model. Field guide: README.md in this directory. Schema: data/schema/performance-values.schema.json.",
  "schema_version": "1.0.0",
  "values_id": "gefly.aircraft.c172s-classic.performance-values",
  "values_version": "0.2.0",
  "status": "draft",
  "fidelity": "not validated",
  "manifest": {
    "path": "manifest.json",
    "manifest_id": "gefly.aircraft.c172s-classic"
  },
  "extraction": "User decision 2026-11-01 18:43 (GAPS Q5): extract only the needed points of the Lycoming IO-360-L2A power curve as cited facts, never the whole chart; user decision 2026-11-01 19:04 (GAPS Q5): likewise selected points of the Lycoming fuel-consumption chart (Figure 3-9); the no-piecemeal rule of the POH extraction applies. POH cruise and glide values follow the user decision 2026-11-01 13:59. Purpose: calibration of a JSBSim piston engine and airframe in the circuit regime (research note docs/research/2026-11-01-c172s-poh-values.md). Chart points were read on page images rendered at 400 dpi.",
  "engine_ratings": {
    "rated_power_normal": {
      "value": 119312.0,
      "unit": "W",
      "original_value": 160,
      "original_unit": "hp",
      "condition": "IO-360-L2A normal rating, at 2400 rpm",
      "status": "sourced",
      "citations": [
        {
          "source_id": "A14",
          "revision": "60297-12, 8th ed. Oct 2005, revision 60297-12-5 Dec 2009",
          "page": "2-2",
          "section": "Section 2 Specifications, IO-360-L2A block and its footnote; no revision mark on page"
        }
      ],
      "reading": "tabulated",
      "conversion": "hp x 745.69987158227022 W (mechanical horsepower), rounded to 0.1 W",
      "uncertainty": "As published; uninstalled engine. The 172S uses the alternate rating (manifest engine.ratings)."
    },
    "rated_speed_normal": {
      "value": 251.3274,
      "unit": "rad/s",
      "original_value": 2400,
      "original_unit": "rpm",
      "condition": "IO-360-L2A normal rating speed",
      "status": "sourced",
      "citations": [
        {
          "source_id": "A14",
          "revision": "60297-12, 8th ed. Oct 2005, revision 60297-12-5 Dec 2009",
          "page": "2-2",
          "section": "Section 2 Specifications, IO-360-L2A block and its footnote; no revision mark on page"
        }
      ],
      "reading": "tabulated",
      "conversion": "rpm x 2 pi / 60, rounded to 4 decimals",
      "uncertainty": "As published."
    },
    "rated_power_alternate": {
      "value": 134226.0,
      "unit": "W",
      "original_value": 180,
      "original_unit": "hp",
      "condition": "IO-360-L2A alternate rating, at 2700 rpm (footnote); the rating used by the 172S",
      "status": "sourced",
      "citations": [
        {
          "source_id": "A14",
          "revision": "60297-12, 8th ed. Oct 2005, revision 60297-12-5 Dec 2009",
          "page": "2-2",
          "section": "Section 2 Specifications, IO-360-L2A block and its footnote; no revision mark on page"
        },
        {
          "source_id": "S9",
          "revision": "Issue 03, 24 Aug 2022",
          "page": "11",
          "section": "6"
        }
      ],
      "reading": "tabulated",
      "conversion": "hp x 745.69987158227022 W (mechanical horsepower), rounded to 0.1 W",
      "uncertainty": "As published; agrees with S9 (134 kW, 180 HP at 2700 rpm, alternate rating) and with the manifest rated_power."
    },
    "rated_speed_alternate": {
      "value": 282.7433,
      "unit": "rad/s",
      "original_value": 2700,
      "original_unit": "rpm",
      "condition": "IO-360-L2A alternate rating speed (footnote)",
      "status": "sourced",
      "citations": [
        {
          "source_id": "A14",
          "revision": "60297-12, 8th ed. Oct 2005, revision 60297-12-5 Dec 2009",
          "page": "2-2",
          "section": "Section 2 Specifications, IO-360-L2A block and its footnote; no revision mark on page"
        }
      ],
      "reading": "tabulated",
      "conversion": "rpm x 2 pi / 60, rounded to 4 decimals",
      "uncertainty": "As published; agrees with the 172S TCDS maximum rpm in the manifest."
    },
    "displacement": {
      "value": 0.0059157,
      "unit": "m^3",
      "original_value": 361.0,
      "original_unit": "in^3",
      "condition": "Total piston displacement",
      "status": "sourced",
      "citations": [
        {
          "source_id": "A14",
          "revision": "60297-12, 8th ed. Oct 2005, revision 60297-12-5 Dec 2009",
          "page": "2-2",
          "section": "Section 2 Specifications, IO-360-L2A block and its footnote; no revision mark on page"
        }
      ],
      "reading": "tabulated",
      "conversion": "in^3 x 1.6387064e-5 m^3 (exact), rounded to 5 significant digits",
      "uncertainty": "As published to 0.1 in^3."
    }
  },
  "engine_sea_level": {
    "full_throttle": {
      "condition": "Uninstalled engine, sea-level standard temperature and pressure, maximum-power mixture, fuel minimum grade 91/96; point at the upper (full-throttle) end of each drawn sea-level curve. The chart is drawn for the 160 hp / 2400 rpm rating; curves for 2500-2700 rpm are dashed, and the chart legend read does not state what the dashing means.",
      "status": "sourced",
      "citations": [
        {
          "source_id": "A14",
          "revision": "60297-12, 8th ed. Oct 2005, revision 60297-12-5 Dec 2009",
          "page": "3-40",
          "section": "Section 3, Figure 3-25 Sea Level and Altitude Performance IO-360-L2A, curve no. 13516-A, sea-level panel; no revision mark on page"
        }
      ],
      "reading": "read_from_chart",
      "selection": "Curve ends at 2000, 2400, 2500 and 2700 rpm: lower circuit power, the normal rating (check against p. 2-2), and the 2500-2700 rpm range of the 172S alternate rating. 4 of the 8 drawn curves; other curves not read.",
      "conversion": "rpm x 2 pi / 60 (4 decimals); inHg x 3386.389 Pa (conventional inch of mercury, NIST SP 811; 0.1 Pa); hp x 745.69987158227022 W (0.1 W)",
      "uncertainty": "Read off a scanned chart with pixel interpolation between grid lines (5 hp, 1 inHg); power +/-2 hp and manifold pressure +/-0.1 inHg, except 2500 rpm (curve ends in a short dash) +/-3 hp. The 2700 rpm curve ends at a small circle on the 180 hp grid line, whose top grid row is drawn wider than the others. Uninstalled-engine data: installation (induction, exhaust, cooling) losses and the fixed-pitch propeller's rpm limits are not included. Cross-check: altitude-panel sea-level intercepts agree within 1.5 hp (research note).",
      "points": [
        {
          "engine_speed": {
            "value": 209.4395,
            "unit": "rad/s",
            "original_value": 2000,
            "original_unit": "rpm"
          },
          "manifold_pressure": {
            "value": 99898.5,
            "unit": "Pa",
            "original_value": 29.5,
            "original_unit": "inHg"
          },
          "power": {
            "value": 104398.0,
            "unit": "W",
            "original_value": 140,
            "original_unit": "hp"
          }
        },
        {
          "engine_speed": {
            "value": 251.3274,
            "unit": "rad/s",
            "original_value": 2400,
            "original_unit": "rpm"
          },
          "manifold_pressure": {
            "value": 98543.9,
            "unit": "Pa",
            "original_value": 29.1,
            "original_unit": "inHg"
          },
          "power": {
            "value": 119312.0,
            "unit": "W",
            "original_value": 160,
            "original_unit": "hp"
          }
        },
        {
          "engine_speed": {
            "value": 261.7994,
            "unit": "rad/s",
            "original_value": 2500,
            "original_unit": "rpm"
          },
          "manifold_pressure": {
            "value": 98543.9,
            "unit": "Pa",
            "original_value": 29.1,
            "original_unit": "inHg"
          },
          "power": {
            "value": 123786.2,
            "unit": "W",
            "original_value": 166,
            "original_unit": "hp"
          }
        },
        {
          "engine_speed": {
            "value": 282.7433,
            "unit": "rad/s",
            "original_value": 2700,
            "original_unit": "rpm"
          },
          "manifold_pressure": {
            "value": 97189.4,
            "unit": "Pa",
            "original_value": 28.7,
            "original_unit": "inHg"
          },
          "power": {
            "value": 134226.0,
            "unit": "W",
            "original_value": 180,
            "original_unit": "hp"
          }
        }
      ]
    },
    "full_throttle_2300_rpm": {
      "condition": "As full_throttle, at 2300 rpm",
      "status": "unknown",
      "citations": [
        {
          "source_id": "A14",
          "revision": "60297-12, 8th ed. Oct 2005, revision 60297-12-5 Dec 2009",
          "page": "3-40",
          "section": "Section 3, Figure 3-25 Sea Level and Altitude Performance IO-360-L2A, curve no. 13516-A, sea-level panel; no revision mark on page"
        }
      ],
      "reading": "read_from_chart",
      "selection": "Requested for the circuit regime.",
      "uncertainty": "The chart has no 2300 rpm curve (curves at 1600, 1800, 2000, 2200, 2400, 2500, 2600, 2700 rpm).",
      "points": [],
      "todo": "Decide in the engine model whether to interpolate between the 2200 and 2400 rpm curves (a derived value with its method) instead of reading a value the chart does not draw."
    },
    "part_throttle": {
      "condition": "Uninstalled engine, sea-level standard temperature and pressure, maximum-power mixture; power on the sea-level curve at the given absolute manifold pressure",
      "status": "sourced",
      "citations": [
        {
          "source_id": "A14",